"ID","Description","GeneRatio","BgRatio","RichFactor","FoldEnrichment","zScore","pvalue","p.adjust","qvalue","geneID","Count","genes_presentes","n_genes_robustos","Database","category","subcategory"
"GO:0045931","positive regulation of mitotic cell cycle","8/314","105/16867",0.0761904761904762,4.09269032453746,4.37825126211581,0.000770245300828591,0.0417716200031048,0.0417716200031048,"SMOC2/CCNB1/UBE2C/AURKA/DLGAP5/DDR2/CDC20/CDK1",8,"SMOC2, CCNB1, UBE2C, AURKA, DLGAP5, DDR2, CDC20, CDK1",8,"GO_BP",NA,NA
"GO:0055123","digestive system development","7/314","81/16867",0.0864197530864197,4.64217189588739,4.52545086023593,0.000775998057014157,0.0417716200031048,0.0417716200031048,"RBPMS2/CCNB1/PDGFRA/FOXF1/RARRES2/RARB/WLS",7,"RBPMS2, CCNB1, PDGFRA, FOXF1, RARRES2, RARB, WLS",7,"GO_BP",NA,NA
"GO:0031401","positive regulation of protein modification process","16/314","345/16867",0.0463768115942029,2.49120280624019,3.85431730967567,0.00078091309682107,0.0417716200031048,0.0417716200031048,"PELI2/TPX2/VEGFA/FGFR3/GNL3/UBE2C/FAXDC2/FANCI/CAV1/NIBAN1/DCUN1D4/RARRES2/DDR2/GAS6/CDC20/CLIP3",16,"PELI2, TPX2, VEGFA, FGFR3, GNL3, UBE2C, FAXDC2, FANCI, CAV1, NIBAN1, DCUN1D4, RARRES2, DDR2, GAS6, CDC20, CLIP3",16,"GO_BP",NA,NA
"GO:1901988","negative regulation of cell cycle phase transition","13/314","248/16867",0.0524193548387097,2.81578744606534,3.96753640278181,0.000792467178715672,0.0420007604719306,0.0420007604719306,"CENPF/CCNB1/AURKB/TRIP13/TIMELESS/KANK2/FHL1/H2AX/RFC5/CDC20/FANCD2/CDK1/TTK",13,"CENPF, CCNB1, AURKB, TRIP13, TIMELESS, KANK2, FHL1, H2AX, RFC5, CDC20, FANCD2, CDK1, TTK",13,"GO_BP",NA,NA
"GO:0006937","regulation of muscle contraction","10/314","161/16867",0.062111801242236,3.33643232978597,4.10263065754891,0.000883828941681897,0.0440162051387614,0.0440162051387614,"TPM1/PPP1R12B/CNN1/CAV1/ENO1/MYL9/RGS2/BIN1/JUP/CASQ2",10,"TPM1, PPP1R12B, CNN1, CAV1, ENO1, MYL9, RGS2, BIN1, JUP, CASQ2",10,"GO_BP",NA,NA
"GO:0071453","cellular response to oxygen levels","10/314","161/16867",0.062111801242236,3.33643232978597,4.10263065754891,0.000883828941681897,0.0440162051387614,0.0440162051387614,"VEGFA/CCNB1/AQP1/PTGIS/CAV1/ENO1/UCK2/DDR2/EEF2K/SFRP1",10,"VEGFA, CCNB1, AQP1, PTGIS, CAV1, ENO1, UCK2, DDR2, EEF2K, SFRP1",10,"GO_BP",NA,NA
"GO:0032233","positive regulation of actin filament bundle assembly","6/314","61/16867",0.0983606557377049,5.28359611569385,4.616084694161,0.000932121634356354,0.044686997632845,0.044686997632845,"TPM1/FERMT2/FLNA/SFRP1/TGFB3/EPHA1",6,"TPM1, FERMT2, FLNA, SFRP1, TGFB3, EPHA1",6,"GO_BP",NA,NA
"GO:0048251","elastic fiber assembly","3/314","11/16867",0.272727272727273,14.6499710480602,6.23710888719512,0.000943710180233182,0.044686997632845,0.044686997632845,"MFAP4/MYH11/FBLN5",3,"MFAP4, MYH11, FBLN5",3,"GO_BP",NA,NA
"GO:1903044","protein localization to membrane raft","3/314","11/16867",0.272727272727273,14.6499710480602,6.23710888719512,0.000943710180233182,0.044686997632845,0.044686997632845,"CAV1/CD24/MYADM",3,"CAV1, CD24, MYADM",3,"GO_BP",NA,NA
