"ID","Description","GeneRatio","BgRatio","RichFactor","FoldEnrichment","zScore","pvalue","p.adjust","qvalue","geneID","Count","genes_presentes","n_genes_robustos","Database","category","subcategory"
"GO:0055002","striated muscle cell development","17/314","125/16867",0.136,7.30545222929936,9.74540948201514,1.63833689697123e-10,4.7323361269014e-07,4.7323361269014e-07,"VEGFA/TPM1/CCNB1/TMOD1/CSRP1/PDGFRA/KRT19/MEIS1/ACTC1/MYL9/RGS2/SORBS2/MYH11/KRT8/FLNC/CDK1/LMOD1",17,"VEGFA, TPM1, CCNB1, TMOD1, CSRP1, PDGFRA, KRT19, MEIS1, ACTC1, MYL9, RGS2, SORBS2, MYH11, KRT8, FLNC, CDK1, LMOD1",17,"GO_BP",NA,NA
"GO:0031032","actomyosin structure organization","19/314","190/16867",0.1,5.37165605095541,8.34634507117465,2.82696990727124e-09,5.44380171810198e-06,5.44380171810198e-06,"TPM1/TMOD1/FERMT2/CSRP1/PDGFRA/KRT19/CNN1/ACTC1/CGNL1/MYL9/MYH11/FAM171A1/KRT8/FLNC/SORBS1/SFRP1/LMOD1/TGFB3/EPHA1",19,"TPM1, TMOD1, FERMT2, CSRP1, PDGFRA, KRT19, CNN1, ACTC1, CGNL1, MYL9, MYH11, FAM171A1, KRT8, FLNC, SORBS1, SFRP1, LMOD1, TGFB3, EPHA1",19,"GO_BP",NA,NA
"hsa04820","Cytoskeleton in muscle cells","21/178","233/8321",0.0901287553648069,4.21326614264358,7.35501451488204,2.11344890188863e-08,7.43934013464797e-06,7.43934013464797e-06,"TPM1/TMOD1/COL6A2/MYOT/CSRP1/SGCA/ACTG2/ACTC1/ENO1/DES/MYL9/TPM2/FHL1/JUP/MYH11/SSPN/FLNC/DCN/ITGA8/LMOD1/PDLIM3",21,"TPM1, TMOD1, COL6A2, MYOT, CSRP1, SGCA, ACTG2, ACTC1, ENO1, DES, MYL9, TPM2, FHL1, JUP, MYH11, SSPN, FLNC, DCN, ITGA8, LMOD1, PDLIM3",21,"KEGG","Cellular Processes","Cell motility"
"GO:0006936","muscle contraction","25/314","363/16867",0.068870523415978,3.69948763839905,7.16098167910913,2.06404444845775e-08,2.56929839579735e-05,2.56929839579735e-05,"TPM1/TMOD1/MYOT/PPP1R12B/CNN1/CAV1/SGCA/CRYAB/SLMAP/SYNM/SMTN/ACTC1/ENO1/DES/MYL9/RGS2/TPM2/BIN1/JUP/MYH11/FLNA/SSPN/CASQ2/ACTA2/LMOD1",25,"TPM1, TMOD1, MYOT, PPP1R12B, CNN1, CAV1, SGCA, CRYAB, SLMAP, SYNM, SMTN, ACTC1, ENO1, DES, MYL9, RGS2, TPM2, BIN1, JUP, MYH11, FLNA, SSPN, CASQ2, ACTA2, LMOD1",25,"GO_BP",NA,NA
"GO:0030239","myofibril assembly","11/314","66/16867",0.166666666666667,8.95276008492569,8.9156866711691,3.37436001309844e-08,3.24894629927828e-05,3.24894629927828e-05,"TPM1/TMOD1/CSRP1/PDGFRA/KRT19/ACTC1/MYL9/MYH11/KRT8/FLNC/LMOD1",11,"TPM1, TMOD1, CSRP1, PDGFRA, KRT19, ACTC1, MYL9, MYH11, KRT8, FLNC, LMOD1",11,"GO_BP",NA,NA
"R-HSA-9924644","Developmental Lineages of the Mammary Gland","9/222","40/11090",0.225,11.2398648648649,9.27237411809717,7.00054309280411e-08,0.000119103417875782,0.000119103417875782,"KRT19/CNN1/EPCAM/CD24/KRT14/MYH11/KRT18/KRT8/ACTA2",9,"KRT19, CNN1, EPCAM, CD24, KRT14, MYH11, KRT18, KRT8, ACTA2",9,"REACTOME",NA,NA
"R-HSA-9734779","Developmental Cell Lineages of the Integumentary System","11/222","73/11090",0.150684931506849,7.52745896581513,7.99690192467389,1.93283752386913e-07,0.000119103417875782,0.000119103417875782,"TFRC/KRT19/CNN1/EPCAM/CD24/KRT15/KRT14/MYH11/KRT18/KRT8/ACTA2",11,"TFRC, KRT19, CNN1, EPCAM, CD24, KRT15, KRT14, MYH11, KRT18, KRT8, ACTA2",11,"REACTOME",NA,NA
"R-HSA-445355","Smooth Muscle Contraction","9/222","45/11090",0.2,9.99099099099099,8.63731629099225,2.07980357175404e-07,0.000119103417875782,0.000119103417875782,"TPM1/ACTG2/MYL9/TPM2/MYH11/SORBS1/ACTA2/ALDH2/LMOD1",9,"TPM1, ACTG2, MYL9, TPM2, MYH11, SORBS1, ACTA2, ALDH2, LMOD1",9,"REACTOME",NA,NA
"GO:0000070","mitotic sister chromatid segregation","17/314","200/16867",0.085,4.5659076433121,6.98697011100585,2.13296098190591e-07,0.000136912395471894,0.000136912395471894,"KIF2C/TPX2/CENPF/PRC1/CCNB1/AURKB/UBE2C/TRIP13/SMC4/NUSAP1/NCAPG/DLGAP5/FLNA/CDC20/CDK1/TTK/KIF11",17,"KIF2C, TPX2, CENPF, PRC1, CCNB1, AURKB, UBE2C, TRIP13, SMC4, NUSAP1, NCAPG, DLGAP5, FLNA, CDC20, CDK1, TTK, KIF11",17,"GO_BP",NA,NA
"GO:0045104","intermediate filament cytoskeleton organization","11/314","88/16867",0.125,6.71457006369427,7.40243112641708,6.98868347797337e-07,0.000367032949565928,0.000367032949565928,"KRT19/KRT16/NES/SYNM/DES/KRT7/INA/KRT15/KRT14/KRT20/KRT18",11,"KRT19, KRT16, NES, SYNM, DES, KRT7, INA, KRT15, KRT14, KRT20, KRT18",11,"GO_BP",NA,NA
"GO:0045103","intermediate filament-based process","11/314","89/16867",0.123595505617978,6.63912545623703,7.34630879334259,7.84361859903555e-07,0.000377604872055237,0.000377604872055237,"KRT19/KRT16/NES/SYNM/DES/KRT7/INA/KRT15/KRT14/KRT20/KRT18",11,"KRT19, KRT16, NES, SYNM, DES, KRT7, INA, KRT15, KRT14, KRT20, KRT18",11,"GO_BP",NA,NA
"R-HSA-2514853","Condensation of Prometaphase Chromosomes","5/222","11/11090",0.454545454545455,22.7067977067977,10.2941308521577,1.28714732762264e-06,0.000552829777213923,0.000552829777213923,"CCNB1/SMC4/NCAPG/CCNB2/CDK1",5,"CCNB1, SMC4, NCAPG, CCNB2, CDK1",5,"REACTOME",NA,NA
"GO:0098813","nuclear chromosome segregation","20/314","306/16867",0.065359477124183,3.510886307814,6.10487811493915,1.26447579182016e-06,0.000561913588411157,0.000561913588411157,"KIF2C/TPX2/CENPF/PTTG1/PRC1/CCNB1/TOP2A/AURKB/UBE2C/TRIP13/SMC4/NUSAP1/NCAPG/DLGAP5/FLNA/CDC20/FANCD2/CDK1/TTK/KIF11",20,"KIF2C, TPX2, CENPF, PTTG1, PRC1, CCNB1, TOP2A, AURKB, UBE2C, TRIP13, SMC4, NUSAP1, NCAPG, DLGAP5, FLNA, CDC20, FANCD2, CDK1, TTK, KIF11",20,"GO_BP",NA,NA
"GO:0055013","cardiac muscle cell development","9/314","62/16867",0.145161290322581,7.79756523525786,7.38520380870985,2.04284449901366e-06,0.000842965190771566,0.000842965190771566,"VEGFA/CCNB1/PDGFRA/MEIS1/ACTC1/RGS2/SORBS2/MYH11/CDK1",9,"VEGFA, CCNB1, PDGFRA, MEIS1, ACTC1, RGS2, SORBS2, MYH11, CDK1",9,"GO_BP",NA,NA
"GO:0007059","chromosome segregation","23/314","410/16867",0.0560975609756098,3.01336802858474,5.68423829577529,2.79476226769392e-06,0.000962839593190667,0.000962839593190667,"KIF2C/TPX2/CENPF/PTTG1/PRC1/CCNB1/TOP2A/AURKB/UBE2C/TRIP13/CENPN/SMC4/NUSAP1/NCAPG/DLGAP5/SRPK1/FLNA/CDC20/CENPU/FANCD2/CDK1/TTK/KIF11",23,"KIF2C, TPX2, CENPF, PTTG1, PRC1, CCNB1, TOP2A, AURKB, UBE2C, TRIP13, CENPN, SMC4, NUSAP1, NCAPG, DLGAP5, SRPK1, FLNA, CDC20, CENPU, FANCD2, CDK1, TTK, KIF11",23,"GO_BP",NA,NA
"GO:1905818","regulation of chromosome separation","10/314","82/16867",0.121951219512195,6.55080006214075,6.93959862634793,2.83335175423946e-06,0.000962839593190667,0.000962839593190667,"CENPF/CCNB1/AURKB/UBE2C/TRIP13/SMC4/NCAPG/DLGAP5/CDC20/TTK",10,"CENPF, CCNB1, AURKB, UBE2C, TRIP13, SMC4, NCAPG, DLGAP5, CDC20, TTK",10,"GO_BP",NA,NA
"GO:0055006","cardiac cell development","9/314","69/16867",0.130434782608696,7.00650789255054,6.88573529768222,5.09146812984836e-06,0.00149035706351702,0.00149035706351702,"VEGFA/CCNB1/PDGFRA/MEIS1/ACTC1/RGS2/SORBS2/MYH11/CDK1",9,"VEGFA, CCNB1, PDGFRA, MEIS1, ACTC1, RGS2, SORBS2, MYH11, CDK1",9,"GO_BP",NA,NA
"GO:0010927","cellular component assembly involved in morphogenesis","11/314","112/16867",0.0982142857142857,5.27573362147407,6.25287793260315,7.71149259159785e-06,0.00193692576963743,0.00193692576963743,"TPM1/TMOD1/CSRP1/PDGFRA/KRT19/ACTC1/MYL9/MYH11/KRT8/FLNC/LMOD1",11,"TPM1, TMOD1, CSRP1, PDGFRA, KRT19, ACTC1, MYL9, MYH11, KRT8, FLNC, LMOD1",11,"GO_BP",NA,NA
"GO:1902903","regulation of supramolecular fiber organization","20/314","351/16867",0.056980056980057,3.06077267860707,5.37358005767929,1.00334049174751e-05,0.00231851920833015,0.00231851920833015,"TPX2/TPM1/TMOD1/FERMT2/AURKB/CRYAB/CGNL1/BMERB1/MYADM/BIN1/KANK2/CXCL12/MAP1A/FLNA/CLIP3/SLIT2/SFRP1/LMOD1/TGFB3/EPHA1",20,"TPX2, TPM1, TMOD1, FERMT2, AURKB, CRYAB, CGNL1, BMERB1, MYADM, BIN1, KANK2, CXCL12, MAP1A, FLNA, CLIP3, SLIT2, SFRP1, LMOD1, TGFB3, EPHA1",20,"GO_BP",NA,NA
"GO:0051983","regulation of chromosome segregation","12/314","139/16867",0.0863309352517986,4.63740090729964,5.9307425983644,1.13518842402583e-05,0.00252230135599894,0.00252230135599894,"KIF2C/CENPF/CCNB1/AURKB/UBE2C/TRIP13/SMC4/NCAPG/DLGAP5/CDC20/CDK1/TTK",12,"KIF2C, CENPF, CCNB1, AURKB, UBE2C, TRIP13, SMC4, NCAPG, DLGAP5, CDC20, CDK1, TTK",12,"GO_BP",NA,NA
"R-HSA-9734767","Developmental Cell Lineages","13/222","153/11090",0.0849673202614379,4.24453865630336,5.77560423623928,1.17953615757224e-05,0.00405288623741822,0.00405288623741822,"TFRC/AQP1/KRT19/CNN1/EPCAM/CD24/KRT7/KRT15/KRT14/MYH11/KRT18/KRT8/ACTA2",13,"TFRC, AQP1, KRT19, CNN1, EPCAM, CD24, KRT7, KRT15, KRT14, MYH11, KRT18, KRT8, ACTA2",13,"REACTOME",NA,NA
"R-HSA-397014","Muscle contraction","15/222","205/11090",0.0731707317073171,3.65524060646012,5.48421483258322,1.54184345768535e-05,0.00441481176717239,0.00441481176717239,"TRPC1/TPM1/FXYD6/TMOD1/ACTG2/ACTC1/DES/MYL9/TPM2/MYH11/CASQ2/SORBS1/ACTA2/ALDH2/LMOD1",15,"TRPC1, TPM1, FXYD6, TMOD1, ACTG2, ACTC1, DES, MYL9, TPM2, MYH11, CASQ2, SORBS1, ACTA2, ALDH2, LMOD1",15,"REACTOME",NA,NA
"R-HSA-9927426","Developmental Lineage of Mammary Gland Alveolar Cells","5/222","18/11090",0.277777777777778,13.8763763763764,7.81384407616839,2.12836748810113e-05,0.00510435327770272,0.00510435327770272,"KRT19/EPCAM/CD24/KRT18/KRT8",5,"KRT19, EPCAM, CD24, KRT18, KRT8",5,"REACTOME",NA,NA
"R-HSA-1474244","Extracellular matrix organization","19/222","321/11090",0.059190031152648,2.95683534001291,5.08471920608013,2.37688161941919e-05,0.00510435327770272,0.00510435327770272,"P3H2/COL6A2/MMP1/MFAP5/MFAP4/SGCA/ACTG2/ACTC1/MMP10/A2M/JAM3/DDR2/JAM2/SSPN/ACTA2/DCN/ITGA8/FBLN5/TGFB3",19,"P3H2, COL6A2, MMP1, MFAP5, MFAP4, SGCA, ACTG2, ACTC1, MMP10, A2M, JAM3, DDR2, JAM2, SSPN, ACTA2, DCN, ITGA8, FBLN5, TGFB3",19,"REACTOME",NA,NA
"GO:0000280","nuclear division","21/314","409/16867",0.0513447432762836,2.75806300904801,4.9572414873089,2.87594592241805e-05,0.00593369271207468,0.00593369271207468,"KIF2C/TPX2/CENPF/PTTG1/PRC1/CCNB1/TOP2A/AURKB/UBE2C/AURKA/TRIP13/SMC4/NUSAP1/NCAPG/DLGAP5/FLNA/CDC20/FANCD2/CDK1/TTK/KIF11",21,"KIF2C, TPX2, CENPF, PTTG1, PRC1, CCNB1, TOP2A, AURKB, UBE2C, AURKA, TRIP13, SMC4, NUSAP1, NCAPG, DLGAP5, FLNA, CDC20, FANCD2, CDK1, TTK, KIF11",21,"GO_BP",NA,NA
"GO:2000146","negative regulation of cell motility","17/314","288/16867",0.0590277777777778,3.17076919674452,5.11756353198379,2.98973392573557e-05,0.00595575616861186,0.00595575616861186,"TPM1/DPYSL3/PODN/RECK/MIF/IL33/APOD/KRT16/IGFBP3/SFRP2/CXCL12/JUP/SLIT2/SPINT2/DCN/SFRP1/EPHA1",17,"TPM1, DPYSL3, PODN, RECK, MIF, IL33, APOD, KRT16, IGFBP3, SFRP2, CXCL12, JUP, SLIT2, SPINT2, DCN, SFRP1, EPHA1",17,"GO_BP",NA,NA
"GO:1901342","regulation of vasculature development","17/314","290/16867",0.0586206896551724,3.14890182297386,5.08387798788829,3.2633618449732e-05,0.00628414712613673,0.00628414712613673,"VEGFA/HSPB6/SMOC2/RECK/AQP1/PTGIS/RHOJ/SFRP2/ADGRB3/CXCL12/JUP/ADGRA2/DCN/SFRP1/RRAS/FBLN5/EPHA1",17,"VEGFA, HSPB6, SMOC2, RECK, AQP1, PTGIS, RHOJ, SFRP2, ADGRB3, CXCL12, JUP, ADGRA2, DCN, SFRP1, RRAS, FBLN5, EPHA1",17,"GO_BP",NA,NA
"GO:0048566","embryonic digestive tract development","5/314","21/16867",0.238095238095238,12.7896572641796,7.44551844140852,3.44946915275142e-05,0.00642825267594999,0.00642825267594999,"RBPMS2/PDGFRA/FOXF1/RARRES2/RARB",5,"RBPMS2, PDGFRA, FOXF1, RARRES2, RARB",5,"GO_BP",NA,NA
"R-HSA-9927432","Developmental Lineage of Mammary Gland Myoepithelial Cells","5/222","20/11090",0.25,12.4887387387387,7.34956110293925,3.72738098529685e-05,0.00711515614748887,0.00711515614748887,"CNN1/EPCAM/KRT14/MYH11/ACTA2",5,"CNN1, EPCAM, KRT14, MYH11, ACTA2",5,"REACTOME",NA,NA
"GO:0040013","negative regulation of locomotion","17/314","297/16867",0.0572390572390572,3.07468528169165,4.96823020584384,4.40447509248037e-05,0.00771050079068457,0.00771050079068457,"TPM1/DPYSL3/PODN/RECK/MIF/IL33/APOD/KRT16/IGFBP3/SFRP2/CXCL12/JUP/SLIT2/SPINT2/DCN/SFRP1/EPHA1",17,"TPM1, DPYSL3, PODN, RECK, MIF, IL33, APOD, KRT16, IGFBP3, SFRP2, CXCL12, JUP, SLIT2, SPINT2, DCN, SFRP1, EPHA1",17,"GO_BP",NA,NA
"GO:0008015","blood circulation","22/314","459/16867",0.0479302832244009,2.5746499590636,4.71080426762616,5.23528576156563e-05,0.00840117940126796,0.00840117940126796,"TRPC1/VEGFA/TPM1/CPA3/SERPING1/PTGS1/FERMT2/CAV1/ACTC1/DES/RGS2/AGTR1/RARRES2/BIN1/CXCL12/CELF2/SVEP1/JUP/FLNA/CASQ2/SLIT2/P2RX1",22,"TRPC1, VEGFA, TPM1, CPA3, SERPING1, PTGS1, FERMT2, CAV1, ACTC1, DES, RGS2, AGTR1, RARRES2, BIN1, CXCL12, CELF2, SVEP1, JUP, FLNA, CASQ2, SLIT2, P2RX1",22,"GO_BP",NA,NA
"GO:0010638","positive regulation of organelle organization","22/314","463/16867",0.0475161987041037,2.55240676287298,4.66502156532212,5.95125599754552e-05,0.00904747523626854,0.00904747523626854,"TPM1/FERMT2/AURKB/GNL3/UBE2C/AURKA/SYT11/NES/SMC4/NUSAP1/NCAPG/DLGAP5/BIN1/CCT2/FLNA/CDC20/DCN/SFRP1/CDK1/LMOD1/TGFB3/EPHA1",22,"TPM1, FERMT2, AURKB, GNL3, UBE2C, AURKA, SYT11, NES, SMC4, NUSAP1, NCAPG, DLGAP5, BIN1, CCT2, FLNA, CDC20, DCN, SFRP1, CDK1, LMOD1, TGFB3, EPHA1",22,"GO_BP",NA,NA
"GO:0032970","regulation of actin filament-based process","19/314","367/16867",0.0517711171662125,2.78096634790607,4.75093717957176,6.1917002867736e-05,0.00915932799059622,0.00915932799059622,"TPM1/TMOD1/FERMT2/PDGFRA/CAV1/CGNL1/MYADM/BIN1/KANK2/CXCL12/JUP/FLNA/SLIT2/ACTA2/SFRP1/LMOD1/TGFB3/DIXDC1/EPHA1",19,"TPM1, TMOD1, FERMT2, PDGFRA, CAV1, CGNL1, MYADM, BIN1, KANK2, CXCL12, JUP, FLNA, SLIT2, ACTA2, SFRP1, LMOD1, TGFB3, DIXDC1, EPHA1",19,"GO_BP",NA,NA
"GO:0060537","muscle tissue development","16/314","276/16867",0.0579710144927536,3.11400350780024,4.87704179590293,6.34341450566303e-05,0.00915932799059622,0.00915932799059622,"VEGFA/TPM1/CCNB1/CSRP1/PDGFRA/CAV1/GJB6/MEIS1/ACTC1/POPDC1/RGS2/SORBS2/MYH11/FZD7/CDK1/ITGA8",16,"VEGFA, TPM1, CCNB1, CSRP1, PDGFRA, CAV1, GJB6, MEIS1, ACTC1, POPDC1, RGS2, SORBS2, MYH11, FZD7, CDK1, ITGA8",16,"GO_BP",NA,NA
"GO:0048146","positive regulation of fibroblast proliferation","6/314","38/16867",0.157894736842105,8.48156218571907,6.35897983342681,6.63071344856982e-05,0.00915932799059622,0.00915932799059622,"MIF/AQP1/PDGFRA/PDGFC/DDR2/GAS6",6,"MIF, AQP1, PDGFRA, PDGFC, DDR2, GAS6",6,"GO_BP",NA,NA
"GO:0007088","regulation of mitotic nuclear division","10/314","120/16867",0.0833333333333333,4.47638004246284,5.26358784542823,8.25066214023874e-05,0.0105920167075909,0.0105920167075909,"CENPF/CCNB1/AURKB/UBE2C/AURKA/TRIP13/NUSAP1/DLGAP5/CDC20/TTK",10,"CENPF, CCNB1, AURKB, UBE2C, AURKA, TRIP13, NUSAP1, DLGAP5, CDC20, TTK",10,"GO_BP",NA,NA
"GO:0042325","regulation of phosphorylation","20/314","409/16867",0.0488997555012225,2.62672667528382,4.5869100946477,8.74128526334603e-05,0.0106196336404568,0.0106196336404568,"PELI2/TPX2/VEGFA/SFN/FGFR3/CNKSR3/MIF/MCM7/FAXDC2/NIBAN1/IGFBP3/SFRP2/RARRES2/CDKN3/DDR2/GAS6/CLIP3/SLIT2/FZD7/SFRP1",20,"PELI2, TPX2, VEGFA, SFN, FGFR3, CNKSR3, MIF, MCM7, FAXDC2, NIBAN1, IGFBP3, SFRP2, RARRES2, CDKN3, DDR2, GAS6, CLIP3, SLIT2, FZD7, SFRP1",20,"GO_BP",NA,NA
"GO:0072001","renal system development","14/314","230/16867",0.0608695652173913,3.26970368319025,4.7734028340112,0.000108535614586656,0.0125402049093423,0.0125402049093423,"VEGFA/CENPF/AQP1/PDGFRA/ZBTB16/EPCAM/FOXF1/CD24/AGTR1/KANK2/SLIT2/ACTA2/SFRP1/ITGA8",14,"VEGFA, CENPF, AQP1, PDGFRA, ZBTB16, EPCAM, FOXF1, CD24, AGTR1, KANK2, SLIT2, ACTA2, SFRP1, ITGA8",14,"GO_BP",NA,NA
"GO:0031589","cell-substrate adhesion","17/314","326/16867",0.0521472392638037,2.80117033332031,4.5228815996278,0.000137891356444282,0.0153191993495888,0.0153191993495888,"VEGFA/FERMT2/EPDR1/APOD/POPDC1/MYADM/SVEP1/HACD1/JUP/FLNA/SORBS1/FZD7/SFRP1/RRAS/ITGA8/FBLN5/EPHA1",17,"VEGFA, FERMT2, EPDR1, APOD, POPDC1, MYADM, SVEP1, HACD1, JUP, FLNA, SORBS1, FZD7, SFRP1, RRAS, ITGA8, FBLN5, EPHA1",17,"GO_BP",NA,NA
"R-HSA-9927418","Developmental Lineage of Mammary Gland Luminal Epithelial Cells","5/222","24/11090",0.208333333333333,10.4072822822823,6.59359591332513,9.57220764562361e-05,0.0164450527351814,0.0164450527351814,"KRT19/EPCAM/CD24/KRT18/KRT8",5,"KRT19, EPCAM, CD24, KRT18, KRT8",5,"REACTOME",NA,NA
"GO:0010811","positive regulation of cell-substrate adhesion","9/314","106/16867",0.0849056603773585,4.56084004326403,5.06509912768056,0.000161736237738334,0.0169335717482826,0.0169335717482826,"VEGFA/FERMT2/MYADM/HACD1/JUP/FLNA/SFRP1/RRAS/EPHA1",9,"VEGFA, FERMT2, MYADM, HACD1, JUP, FLNA, SFRP1, RRAS, EPHA1",9,"GO_BP",NA,NA
"GO:0048144","fibroblast proliferation","7/314","63/16867",0.111111111111111,5.96850672328379,5.44154637352394,0.000164147484490882,0.0169335717482826,0.0169335717482826,"MIF/AQP1/PDGFRA/PDGFC/DDR2/GAS6/SFRP1",7,"MIF, AQP1, PDGFRA, PDGFC, DDR2, GAS6, SFRP1",7,"GO_BP",NA,NA
"GO:0048729","tissue morphogenesis","19/314","396/16867",0.047979797979798,2.577309721418,4.37458746193189,0.000167358336201694,0.0169619141795997,0.0169619141795997,"VEGFA/TPM1/ARHGAP24/FERMT2/KRT19/KRT16/TIMELESS/FOXF1/ACTG2/ACTC1/SFRP2/KRT15/KRT14/FLNA/KRT20/WLS/SLIT2/ACTA2/ITGA8",19,"VEGFA, TPM1, ARHGAP24, FERMT2, KRT19, KRT16, TIMELESS, FOXF1, ACTG2, ACTC1, SFRP2, KRT15, KRT14, FLNA, KRT20, WLS, SLIT2, ACTA2, ITGA8",19,"GO_BP",NA,NA
"GO:0030261","chromosome condensation","6/314","45/16867",0.133333333333333,7.16220806794055,5.70080669873052,0.000175374745961552,0.0170164962776676,0.0170164962776676,"CCNB1/TOP2A/SMC4/NUSAP1/NCAPG/CDK1",6,"CCNB1, TOP2A, SMC4, NUSAP1, NCAPG, CDK1",6,"GO_BP",NA,NA
"GO:0040008","regulation of growth","21/314","465/16867",0.0451612903225806,2.42590918430245,4.29439959792972,0.000177234293716139,0.0170164962776676,0.0170164962776676,"VEGFA/SFN/CCNB1/FGFR3/SLIT3/CPNE8/CRYAB/ENO1/SFRP2/RGS2/AGTR1/GHR/RERG/CXCL12/FHL1/JUP/WFDC1/SLIT2/S100A9/SFRP1/CDK1",21,"VEGFA, SFN, CCNB1, FGFR3, SLIT3, CPNE8, CRYAB, ENO1, SFRP2, RGS2, AGTR1, GHR, RERG, CXCL12, FHL1, JUP, WFDC1, SLIT2, S100A9, SFRP1, CDK1",21,"GO_BP",NA,NA
"GO:0048846","axon extension involved in axon guidance","4/314","16/16867",0.25,13.4291401273885,6.85047602691211,0.000179679119428375,0.0170164962776676,0.0170164962776676,"VEGFA/SLIT3/CXCL12/SLIT2",4,"VEGFA, SLIT3, CXCL12, SLIT2",4,"GO_BP",NA,NA
"GO:1902850","microtubule cytoskeleton organization involved in mitosis","11/314","158/16867",0.069620253164557,3.7397605418044,4.76538984622168,0.000185382917072979,0.0172735018053323,0.0172735018053323,"TPX2/PRC1/CCNB1/AURKB/AURKA/NUSAP1/DLGAP5/FLNA/CDK1/TTK/KIF11",11,"TPX2, PRC1, CCNB1, AURKB, AURKA, NUSAP1, DLGAP5, FLNA, CDK1, TTK, KIF11",11,"GO_BP",NA,NA
"GO:0110053","regulation of actin filament organization","14/314","243/16867",0.0576131687242798,3.09478126392493,4.53008725404272,0.000193068710006563,0.0175116852314654,0.0175116852314654,"TPM1/TMOD1/FERMT2/CGNL1/MYADM/BIN1/KANK2/CXCL12/FLNA/SLIT2/SFRP1/LMOD1/TGFB3/EPHA1",14,"TPM1, TMOD1, FERMT2, CGNL1, MYADM, BIN1, KANK2, CXCL12, FLNA, SLIT2, SFRP1, LMOD1, TGFB3, EPHA1",14,"GO_BP",NA,NA
"GO:0051783","regulation of nuclear division","10/314","133/16867",0.075187969924812,4.0388391360567,4.8458075644637,0.000194001705870484,0.0175116852314654,0.0175116852314654,"CENPF/CCNB1/AURKB/UBE2C/AURKA/TRIP13/NUSAP1/DLGAP5/CDC20/TTK",10,"CENPF, CCNB1, AURKB, UBE2C, AURKA, TRIP13, NUSAP1, DLGAP5, CDC20, TTK",10,"GO_BP",NA,NA
"GO:0033044","regulation of chromosome organization","14/314","244/16867",0.0573770491803279,3.08209773415475,4.5120493056137,0.00020145052087433,0.0176330251377425,0.0176330251377425,"CENPF/CCNB1/AURKB/GNL3/UBE2C/TRIP13/SMC4/NCAPG/AXIN2/DLGAP5/CCT2/CDC20/CDK1/TTK",14,"CENPF, CCNB1, AURKB, GNL3, UBE2C, TRIP13, SMC4, NCAPG, AXIN2, DLGAP5, CCT2, CDC20, CDK1, TTK",14,"GO_BP",NA,NA
"GO:0070252","actin-mediated cell contraction","9/314","112/16867",0.0803571428571429,4.3165093266606,4.85009820953234,0.000245566169473681,0.021173668075365,0.021173668075365,"TPM1/EPDR1/CAV1/ACTC1/BIN1/JUP/FLNA/CASQ2/ACTA2",9,"TPM1, EPDR1, CAV1, ACTC1, BIN1, JUP, FLNA, CASQ2, ACTA2",9,"GO_BP",NA,NA
"hsa04110","Cell cycle","12/178","157/8321",0.0764331210191083,3.57303370786517,4.81197376379187,0.000130103891993166,0.0228982849907973,0.0228982849907973,"SFN/PTTG1/CCNB1/MCM4/AURKB/MCM7/TRIP13/CCNB2/CDC20/CDK1/TGFB3/TTK",12,"SFN, PTTG1, CCNB1, MCM4, AURKB, MCM7, TRIP13, CCNB2, CDC20, CDK1, TGFB3, TTK",12,"KEGG","Cellular Processes","Cell growth and death"
"GO:0009611","response to wounding","21/314","482/16867",0.0435684647302905,2.34034807199302,4.1119744240492,0.000287925006768743,0.0244609230015151,0.0244609230015151,"VEGFA/SMOC2/TPM1/ARHGAP24/DPYSL3/SERPING1/FERMT2/CSRP1/PDGFRA/AURKA/IL33/APOD/CAV1/SYT11/MYL9/SVEP1/UCK2/DDR2/FLNA/FZD7/CDK1",21,"VEGFA, SMOC2, TPM1, ARHGAP24, DPYSL3, SERPING1, FERMT2, CSRP1, PDGFRA, AURKA, IL33, APOD, CAV1, SYT11, MYL9, SVEP1, UCK2, DDR2, FLNA, FZD7, CDK1",21,"GO_BP",NA,NA
"GO:0016049","cell growth","19/314","417/16867",0.0455635491606715,2.44751714551925,4.1223162603762,0.000321407007405902,0.0257884483581097,0.0257884483581097,"VEGFA/SFN/SLIT3/CPNE8/CRYAB/MEIS1/ENO1/SFRP2/RGS2/AGTR1/RERG/CXCL12/FHL1/SORBS2/JUP/WFDC1/SLIT2/S100A9/SFRP1",19,"VEGFA, SFN, SLIT3, CPNE8, CRYAB, MEIS1, ENO1, SFRP2, RGS2, AGTR1, RERG, CXCL12, FHL1, SORBS2, JUP, WFDC1, SLIT2, S100A9, SFRP1",19,"GO_BP",NA,NA
"GO:0140694","membraneless organelle assembly","19/314","417/16867",0.0455635491606715,2.44751714551925,4.1223162603762,0.000321407007405902,0.0257884483581097,0.0257884483581097,"TPX2/CENPF/TPM1/PRC1/TMOD1/AURKB/CSRP1/PDGFRA/KRT19/ACTC1/MYL9/CENPN/DLGAP5/MYH11/FLNA/KRT8/FLNC/LMOD1/KIF11",19,"TPX2, CENPF, TPM1, PRC1, TMOD1, AURKB, CSRP1, PDGFRA, KRT19, ACTC1, MYL9, CENPN, DLGAP5, MYH11, FLNA, KRT8, FLNC, LMOD1, KIF11",19,"GO_BP",NA,NA
"GO:0070482","response to oxygen levels","15/314","289/16867",0.0519031141868512,2.78805677385229,4.2227626587869,0.000355523186078024,0.027754830350983,0.027754830350983,"VEGFA/TFRC/CCNB1/AQP1/PTGIS/CAV1/ENO1/SLC7A5/CD24/CXCL12/UCK2/DDR2/EEF2K/SFRP1/TGFB3",15,"VEGFA, TFRC, CCNB1, AQP1, PTGIS, CAV1, ENO1, SLC7A5, CD24, CXCL12, UCK2, DDR2, EEF2K, SFRP1, TGFB3",15,"GO_BP",NA,NA
"GO:0030198","extracellular matrix organization","14/314","260/16867",0.0538461538461538,2.89243018128368,4.23539053167618,0.000384998797421478,0.0290248511235788,0.0290248511235788,"SMOC2/RECK/MMP1/MFAP4/MMP10/AXIN2/SPINT1/FLRT2/DDR2/MYH11/COLEC12/GAS6/DPT/FBLN5",14,"SMOC2, RECK, MMP1, MFAP4, MMP10, AXIN2, SPINT1, FLRT2, DDR2, MYH11, COLEC12, GAS6, DPT, FBLN5",14,"GO_BP",NA,NA
"GO:0035633","maintenance of blood-brain barrier","5/314","34/16867",0.147058823529412,7.89949419258149,5.54636523159652,0.000386864036094092,0.0290248511235788,0.0290248511235788,"VEGFA/LSR/GJB6/JAM3/JAM2",5,"VEGFA, LSR, GJB6, JAM3, JAM2",5,"GO_BP",NA,NA
"GO:0035265","organ growth","8/314","96/16867",0.0833333333333333,4.47638004246284,4.70452628739,0.000423020424606338,0.0305473624118852,0.0305473624118852,"CCNB1/FGFR3/MEIS1/RGS2/SORBS2/DDR2/CDK1/FBLN5",8,"CCNB1, FGFR3, MEIS1, RGS2, SORBS2, DDR2, CDK1, FBLN5",8,"GO_BP",NA,NA
"GO:0001558","regulation of cell growth","17/314","361/16867",0.0470914127423823,2.52958872205657,4.04613033141111,0.000453778858767645,0.0319692739890327,0.0319692739890327,"VEGFA/SFN/SLIT3/CPNE8/CRYAB/ENO1/SFRP2/RGS2/AGTR1/RERG/CXCL12/FHL1/JUP/WFDC1/SLIT2/S100A9/SFRP1",17,"VEGFA, SFN, SLIT3, CPNE8, CRYAB, ENO1, SFRP2, RGS2, AGTR1, RERG, CXCL12, FHL1, JUP, WFDC1, SLIT2, S100A9, SFRP1",17,"GO_BP",NA,NA
"GO:0001932","regulation of protein phosphorylation","17/314","367/16867",0.0463215258855586,2.48823304812649,3.97003667616994,0.000546816413594386,0.0373954566428614,0.0373954566428614,"PELI2/TPX2/VEGFA/SFN/FGFR3/CNKSR3/FAXDC2/NIBAN1/IGFBP3/SFRP2/RARRES2/CDKN3/DDR2/GAS6/CLIP3/SLIT2/SFRP1",17,"PELI2, TPX2, VEGFA, SFN, FGFR3, CNKSR3, FAXDC2, NIBAN1, IGFBP3, SFRP2, RARRES2, CDKN3, DDR2, GAS6, CLIP3, SLIT2, SFRP1",17,"GO_BP",NA,NA
"GO:0045937","positive regulation of phosphate metabolic process","15/314","303/16867",0.0495049504950495,2.65923566878981,4.01401779122845,0.000582883544049521,0.0373954566428614,0.0373954566428614,"PELI2/PID1/TPX2/VEGFA/FGFR3/MIF/ZBTB20/FAXDC2/NIBAN1/ENO1/RARRES2/DDR2/GAS6/CLIP3/FZD7",15,"PELI2, PID1, TPX2, VEGFA, FGFR3, MIF, ZBTB20, FAXDC2, NIBAN1, ENO1, RARRES2, DDR2, GAS6, CLIP3, FZD7",15,"GO_BP",NA,NA
"GO:0007094","mitotic spindle assembly checkpoint signaling","6/314","56/16867",0.107142857142857,5.7553457688808,4.90921276275472,0.000589057738359076,0.0373954566428614,0.0373954566428614,"CENPF/CCNB1/AURKB/TRIP13/CDC20/TTK",6,"CENPF, CCNB1, AURKB, TRIP13, CDC20, TTK",6,"GO_BP",NA,NA
"GO:0071173","spindle assembly checkpoint signaling","6/314","56/16867",0.107142857142857,5.7553457688808,4.90921276275472,0.000589057738359076,0.0373954566428614,0.0373954566428614,"CENPF/CCNB1/AURKB/TRIP13/CDC20/TTK",6,"CENPF, CCNB1, AURKB, TRIP13, CDC20, TTK",6,"GO_BP",NA,NA
"GO:0071174","mitotic spindle checkpoint signaling","6/314","56/16867",0.107142857142857,5.7553457688808,4.90921276275472,0.000589057738359076,0.0373954566428614,0.0373954566428614,"CENPF/CCNB1/AURKB/TRIP13/CDC20/TTK",6,"CENPF, CCNB1, AURKB, TRIP13, CDC20, TTK",6,"GO_BP",NA,NA
"GO:0010639","negative regulation of organelle organization","16/314","337/16867",0.0474777448071217,2.55034115178892,3.95948145427263,0.000607685736990576,0.0381587011151582,0.0381587011151582,"TPX2/CENPF/TFRC/CCNB1/TMOD1/AURKB/TRIP13/CGNL1/BMERB1/MYADM/KANK2/CDC20/CLIP3/SLIT2/LMOD1/TTK",16,"TPX2, CENPF, TFRC, CCNB1, TMOD1, AURKB, TRIP13, CGNL1, BMERB1, MYADM, KANK2, CDC20, CLIP3, SLIT2, LMOD1, TTK",16,"GO_BP",NA,NA
"GO:0090263","positive regulation of canonical Wnt signaling pathway","8/314","102/16867",0.0784313725490196,4.2130635693768,4.48280801246993,0.000635561973960849,0.0394800163824928,0.0394800163824928,"RSPO3/RECK/SFRP2/JUP/WLS/ADGRA2/SFRP1/CDH3",8,"RSPO3, RECK, SFRP2, JUP, WLS, ADGRA2, SFRP1, CDH3",8,"GO_BP",NA,NA
"GO:0060856","establishment of blood-brain barrier","3/314","10/16867",0.3,16.1149681528662,6.58490642151632,0.000695899381567404,0.039571925245149,0.039571925245149,"RECK/LSR/ADGRA2",3,"RECK, LSR, ADGRA2",3,"GO_BP",NA,NA
"GO:0045216","cell-cell junction organization","11/314","185/16867",0.0594594594594595,3.19395765191944,4.13259228684153,0.00071239055314099,0.039571925245149,0.039571925245149,"VEGFA/FERMT2/LSR/CAV1/GJB6/CLDN7/JAM3/JUP/GJB2/TGFB3/CDH3",11,"VEGFA, FERMT2, LSR, CAV1, GJB6, CLDN7, JAM3, JUP, GJB2, TGFB3, CDH3",11,"GO_BP",NA,NA
"R-HSA-6809371","Formation of the cornified envelope","10/222","129/11090",0.0775193798449612,3.87247712829108,4.69001476256146,0.000260044414196566,0.0406142094172455,0.0406142094172455,"KRT19/KRT16/SPRR1A/KRT7/KRT15/KRT14/JUP/KRT20/KRT18/KRT8",10,"KRT19, KRT16, SPRR1A, KRT7, KRT15, KRT14, JUP, KRT20, KRT18, KRT8",10,"REACTOME",NA,NA
