"ID","Description","GeneRatio","BgRatio","RichFactor","FoldEnrichment","zScore","pvalue","p.adjust","qvalue","geneID","Count","genes_presentes","n_genes_robustos","Database","category","subcategory"
"GO:0045931","positive regulation of mitotic cell cycle","8/314","105/16867",0.0761904761904762,4.09269032453746,4.37825126211581,0.000770245300828591,0.0417716200031048,0.0417716200031048,"DLGAP5/CDC20/AURKA/CCNB1/UBE2C/CDK1/SMOC2/DDR2",8,"DLGAP5, CDC20, AURKA, CCNB1, UBE2C, CDK1, SMOC2, DDR2",8,"GO_BP",NA,NA
"GO:0055123","digestive system development","7/314","81/16867",0.0864197530864197,4.64217189588739,4.52545086023593,0.000775998057014157,0.0417716200031048,0.0417716200031048,"RARB/PDGFRA/RBPMS2/FOXF1/CCNB1/RARRES2/WLS",7,"RARB, PDGFRA, RBPMS2, FOXF1, CCNB1, RARRES2, WLS",7,"GO_BP",NA,NA
"GO:0031401","positive regulation of protein modification process","16/314","345/16867",0.0463768115942029,2.49120280624019,3.85431730967567,0.00078091309682107,0.0417716200031048,0.0417716200031048,"FANCI/GNL3/PELI2/NIBAN1/FAXDC2/FGFR3/DCUN1D4/CDC20/TPX2/VEGFA/UBE2C/CLIP3/GAS6/RARRES2/CAV1/DDR2",16,"FANCI, GNL3, PELI2, NIBAN1, FAXDC2, FGFR3, DCUN1D4, CDC20, TPX2, VEGFA, UBE2C, CLIP3, GAS6, RARRES2, CAV1, DDR2",16,"GO_BP",NA,NA
"GO:1901988","negative regulation of cell cycle phase transition","13/314","248/16867",0.0524193548387097,2.81578744606534,3.96753640278181,0.000792467178715672,0.0420007604719306,0.0420007604719306,"CENPF/TTK/TIMELESS/CDC20/CCNB1/FANCD2/CDK1/H2AX/AURKB/KANK2/RFC5/TRIP13/FHL1",13,"CENPF, TTK, TIMELESS, CDC20, CCNB1, FANCD2, CDK1, H2AX, AURKB, KANK2, RFC5, TRIP13, FHL1",13,"GO_BP",NA,NA
"GO:0006937","regulation of muscle contraction","10/314","161/16867",0.062111801242236,3.33643232978597,4.10263065754891,0.000883828941681897,0.0440162051387614,0.0440162051387614,"TPM1/RGS2/JUP/MYL9/CNN1/ENO1/PPP1R12B/BIN1/CAV1/CASQ2",10,"TPM1, RGS2, JUP, MYL9, CNN1, ENO1, PPP1R12B, BIN1, CAV1, CASQ2",10,"GO_BP",NA,NA
"GO:0071453","cellular response to oxygen levels","10/314","161/16867",0.062111801242236,3.33643232978597,4.10263065754891,0.000883828941681897,0.0440162051387614,0.0440162051387614,"AQP1/PTGIS/CCNB1/ENO1/VEGFA/UCK2/EEF2K/CAV1/DDR2/SFRP1",10,"AQP1, PTGIS, CCNB1, ENO1, VEGFA, UCK2, EEF2K, CAV1, DDR2, SFRP1",10,"GO_BP",NA,NA
"GO:0032233","positive regulation of actin filament bundle assembly","6/314","61/16867",0.0983606557377049,5.28359611569385,4.616084694161,0.000932121634356354,0.044686997632845,0.044686997632845,"TPM1/FERMT2/EPHA1/FLNA/TGFB3/SFRP1",6,"TPM1, FERMT2, EPHA1, FLNA, TGFB3, SFRP1",6,"GO_BP",NA,NA
"GO:0048251","elastic fiber assembly","3/314","11/16867",0.272727272727273,14.6499710480602,6.23710888719512,0.000943710180233182,0.044686997632845,0.044686997632845,"MYH11/FBLN5/MFAP4",3,"MYH11, FBLN5, MFAP4",3,"GO_BP",NA,NA
"GO:1903044","protein localization to membrane raft","3/314","11/16867",0.272727272727273,14.6499710480602,6.23710888719512,0.000943710180233182,0.044686997632845,0.044686997632845,"CD24/MYADM/CAV1",3,"CD24, MYADM, CAV1",3,"GO_BP",NA,NA
